title,text,url
Trump dice que Maduro no está cumpliendo con el acuerdo de recibir migrantes deportados y anuncia el fin de la licencia para que la petrolera Chevron opere en Venezuela,"El presidente de Estados Unidos, Donald Trump, anunció este miércoles la revocatoria de la licencia que autoriza a la petrolera estadounidense Chevron a operar en Venezuela. ""Por la presente, revertimos las concesiones que el corrupto Joe Biden le dio a Nicolás Maduro, de Venezuela, sobre el acuerdo de transacción petrolera, con fecha del 26 de noviembre de 2022, y que también tiene que ver con las condiciones electorales dentro de Venezuela, que no han sido cumplidas por el régimen de Maduro"", escribió el mandatario en un mensaje en la red Truth Social. ""Además, el régimen no ha estado transportando a los criminales violentos que enviaron a nuestro país (el bueno y viejo Estados Unidos) de regreso a Venezuela al ritmo rápido que habían acordado. Por lo tanto, ordeno que el ineficaz e incumplido 'Acuerdo de Concesión' de Biden se rescinda a partir de la opción de renovación del 1 de marzo"", agregó. La vicepresidenta de Venezuela, Delcy Rodríguez, condenó la medida anunciada por Trump, asegurando que es ""lesiva e inexplicable"", mientras que la petrolera estadounidense dijo que está analizando las implicaciones del anuncio de la Casa Blanca. La licencia para que Chevron pudiera operar en Venezuela fue emitida por el Departamento del Tesoro a finales de 2022, en respuesta a la decisión del gobierno de Maduro de sentarse a negociar con la oposición con miras a acordar la realización de elecciones presidenciales libres en Venezuela. En ese momento, la decisión también fue interpretada como un intento de gobierno de Biden de aumentar el suministro de petróleo en el mercado internacional con miras a lograr una reducción en el costo de la energía, que se había incrementado tras la invasión rusa de Ucrania. El gobierno de Biden rechazó esa interpretación. Un golpe a la economía venezolana La licencia concedida a Chevron prohíbe a la petrolera estatal venezolana, Pdvsa, recibir ganancias procedentes de las operaciones de la empresa conjunta que mantiene con la firma estadounidense. Sin embargo, numerosos analistas destacan el impacto favorable que la operación de la petrolera estadounidense ha tenido sobre la economía venezolana y, en particular, sobre la producción petrolera de ese país. Muchos analistas atribuyen a las operaciones de Chevron el hecho de que Venezuela haya logrado recientemente aumentar su extracción de crudo hasta llegar a un millón de barriles al día, luego de haber caído en años recientes a mínimos históricos de 365.000 barriles, un nivel similar al que producía ese país en la década de 1940. Si Trump mantiene en pie su decisión de revocar la licencia puede asestar un duro golpe a la economía de Venezuela y dar al traste con sus actuales perspectivas de crecimiento. Pese a ser una licencia ""limitada"" desde su emisión, Chevron ha podido aumentar su extracción de crudo en Venezuela de 77.000 barriles al día hasta 241.000 barriles al día, equivalente a un cuarto de toda la producción en ese país. De acuerdo con estimaciones de esa consultora, los ingresos fiscales que ha recibido Venezuela durante los últimos dos años gracias a las asociaciones de Pdvsa con Chevron suman unos US$4.000 millones. Antes de este anuncio de la Casa Blanca, el Fondo Monetario Internacional estimaba que este año la economía venezolana crecería un 3%. La compleja política de Trump hacia Venezuela El anuncio de la decisión de revocar la licencia a Chevron para operar en Venezuela abre una nueva incógnita en torno a la política del gobierno de Trump hacia el país latinoamericano. Hace menos de un mes, el embajador de Trump para misiones especiales, Richard Grenell, fue noticia al convertirse en el primer alto funcionario estadounidense en casi una década en viajar a Caracas y dejarse fotografiar junto a Maduro en el Palacio de Miraflores. El diplomático explicó posteriormente que el objetivo de ese viaje era lograr que Maduro aceptara recibir y costear la deportación de venezolanos desde Estados Unidos, en especial aquellos señalados de ser parte de bandas criminales como el Tren de Aragua. Adicionalmente, logró la liberación de seis estadounidenses que estaban detenidos en Venezuela, donde estaban acusados de participar en supuestas conspiraciones contra el gobierno de Maduro. Tras su viaje, Grenell aseguró que pudo conseguir estos dos objetivos sin dar nada a Maduro como contraparte, más allá de la oportunidad de -aseguró- usar su visita y sus fotografías juntos para hacer propaganda política. Sin embargo, al día siguiente del viaje de Grenell la licencia de Chevron para operar en Venezuela se renovó ""de forma automática"" sin que el gobierno de Trump hiciera nada para evitarlo, lo que hizo que algunos analistas especularan con la idea de que el mantenimiento de la licencia a la petrolera era la contraprestación que el gobierno de Trump le estaba dando a Maduro a cambio de la recepción de deportados. En una entrevista reciente, Grenell aseguró también que estuvo conversando con Maduro para tener una relación distinta con Venezuela. ""Tenemos mucha claridad sobre el gobierno de Venezuela y Maduro, pero Donald Trump es alguien que no quiere hacer cambios de régimen"", dijo. Luego de la reunión de Grenell con Maduro, las cosas parecían ir en la dirección deseada por la Casa Blanca. El 10 de febrero, dos aviones de la estatal venezolana Conviasa aterrizaron en Texas para recoger a unos 190 venezolanos que estaban siendo deportados por EE.UU. Luego, el pasado 20 de febrero, Conviasa recogió en Honduras a unos 170 venezolanos que habían sido inicialmente enviados por Estados Unidos a Guantánamo. Estos gestos del gobierno venezolano, sin embargo, no parecen haber estado a la altura de la expectativas de la Casa Blanca, a juzgar por el anuncio de Trump que ahora deja abierta la duda sobre si su gobierno intenta presionar a Maduro para obtener una mayor colaboración, si se trata de un regreso a la política de máxima presión que aplicó contra el mandatario venezolano en 2019 o si es una política distinta. Dado que la licencia a Chevron está hecha para renovarse automáticamente cada mes y durante un periodo de seis meses, habrá que esperar hasta el 1 de marzo para ver si la Casa Blanca no da marcha atrás y, luego, observar lo que ocurra en los meses siguientes pues, de acuerdo con los términos de la licencia, si esta llega a su fin, Chevron dispone de seis meses para cesar sus operaciones en Venezuela.",https://www.bbc.com/mundo/articles/c5yxvy4z147o
"Cuál es el verdadero origen de la historia de Wicked, la bruja mala del Oeste que cautivó al mundo y compite por el Oscar","Cuando el autor Gregory Maguire era un niño, él y sus hermanos actuaban regularmente en escenas de la película clásica de 1939, ""El mago de Oz"". Incluso cambiaban la historia y sus perspectivas, solo para mantenerse entretenidos. ""El material era tan maleable que podías cambiarlo y seguiría siendo reconocible"", le dice Maguire a la BBC. El libro daría luego origen al musical y ahora a la adaptación al cine de ""Wicked"", que este domingo es una de las nominadas a ganar el premio Oscar a mejor película. A principios de la década de 1990, Maguire era un autor infantil muy respetado, que había recibido ""buenas críticas, pero no buenas ventas"", afirma. Después de trabajar como profesor en el Simmons College Center for the Study of Children's Literature en Boston, y luego de cofundar la organización benéfica educativa sin fines de lucro Children's Literature New England, Maguire quería probar suerte escribiendo para adultos. ""Pensé que tenía que tirar todo lo que me importaba en este libro, porque nunca volvería a escribir otro"", dice. Maguire sabía que el tema que quería explorar en la novela era la naturaleza del mal. En concreto, ¿qué significa ser ""malvado""? ¿Estamos simplemente caracterizando ciertos tipos de comportamiento? ¿Estamos evaluando la decadencia y la corrupción de la fibra moral de alguien? Maguire sabía que si quería conseguir el apoyo de los lectores, tendría que tejer el tema en ""una trama cautivadora que involucrara a cientos de miles de personas en todo el mundo"", asegura. Fue entonces cuando Maguire pensó en ""El mago de Oz"". En particular, la interpretación de Margaret Hamilton de la Malvada Bruja del Oeste y sus breves interacciones con Glinda, interpretada por Billie Burke, hacia el comienzo de la película de Victor Fleming. ""Pensé: 'Se conocen. Se han cruzado antes. ¡Iban juntas a la escuela!'"". Crear este escenario en su cabeza provocó que Maguire se riera a carcajadas. ""Pensé que era muy gracioso. Porque era una muy buena idea"". La suposición de Maguire resultó ser correcta. Maguire la llamó Elphaba, que es un juego de palabras con las iniciales del autor original. En el libro, vemos las razones por las que Elphaba es considerada malvada, ya que las percepciones y circunstancias sociales la obligan a actuar de maneras que se consideran malvadas. Nació con piel verde, y a menudo la señalan y se ríen de ella. Este prejuicio la hace sentir tan marginada que se excluye de otras personas. Después de descubrir que los animales sensibles y parlantes del país están siendo encerrados, Elphaba se acerca a Oz y le pide ayuda. Pero Oz desestima sus preocupaciones, ya que quiere que la gente se una en la creencia de que los animales parlantes son su enemigo común. Elphaba se esconde y se une a un grupo clandestino para tratar de proteger a los animales. Oz luego usa propaganda para decirle al resto del país que Elphaba es malvada, a pesar de que está luchando por la justicia para proteger a los más vulnerables. Luego reacciona con una rabia justificada contra la muerte de su hermana, y Glinda, también conocida como la Bruja Buena del Sur, regalando los zapatos de su familia a Dorothy. De libro a musical y de musical a película Aunque no fue un éxito de ventas cuando se publicó en 1995, el libro fue un éxito de boca en boca, dice Maguire. ""Cada año se vendía más que el año anterior. Era la auténtica definición de un éxito inesperado"". La decisión de Stephen Schwartz de adaptar el libro en un musical lo hizo aún más popular. La versión musical de Elphaba es más incomprendida y más amable que la versión cada vez más oscura y amarga del libro. Tal éxito significaba que una adaptación a Hollywood era inevitable. Pero al igual que el musical, ""Wicked la película (primera parte)"", se desvía del libro en varios aspectos, tal vez para hacerlo más accesible para el público general. En lugar de ser completamente la historia de Elphaba (Cynthia Erivo), también vemos la perspectiva de Glinda (Ariana Grande), ya que la historia gira mucho más en torno a su amistad. La película se desarrolla en la Universidad Shiz en el País de Oz, donde Elphaba y Glinda se ven obligadas a compartir una habitación. Aunque al principio se odian, rápidamente se hacen amigas y ambas se enamoran del mismo apuesto príncipe (Jonathan Bailey). Pero a medida que continúan con sus estudios, descubren la siniestra trama que se desarrolla en el País de Oz, que está obligando a los animales parlantes del país a esconderse. Antes del libro, todo el mundo insistía: ""La bruja verde es malvada. Todos sabemos que es mala. Pero si le preguntas a alguien por qué es malvada, no puede responder"", le dice Fox a la BBC. ""La brillantez del libro de Maguire es que planteó esa misma pregunta"", apunta. La resonancia continua de Wicked El 12 de febrero de 1993, James Bulger, de 2 años, fue asesinado por dos niños de diez años en Merseyside, Inglaterra. Mientras Maguire veía en la televisión los reportajes sobre esta tragedia, la gente en los programas y durante la cena comentaba el terrible crimen que habían cometido estos chicos. Maguire se preguntó: ""¿De dónde surgió la decisión de hacer lo que hicieron? ¿De dónde surgió esa capacidad para el mal?"". ""Ese triste, triste evento resultó ser un catalizador para que yo siguiera adelante"", dice Maguire. Poco después de que se publicara el libro, Maguire se enteró de que el autor ganador del premio Pulitzer John Updike había citado el libro en un ensayo que escribió sobre el tema del mal, afirma. Maguire insiste en que nunca se le ocurrió una ""teoría unificada"" sobre el mal. Cree que el autodesprecio es uno de sus elementos, ya que ""el imperativo biológico de sobrevivir y no hacernos daño es tan fuerte que si nos odiamos lo suficiente apuñalamos al mundo en lugar de a nosotros mismos"". El mejor resumen que ha leído Maguire sobre el mal lo escribió Graham Greene en su novela ""El poder y la gloria"". ""Escribió que la mayoría del mal es simplemente un fracaso de la imaginación"", dice. Greene escribía sobre cómo surge el fascismo ""porque la gente no puede imaginar cómo es ser otra persona"", afirma Maguire. ""No hace falta tener la piel verde para saber cómo se siente eso. Todo el mundo se ha sentido así en la vida"", sostiene Fox. ""Hay un poco de Elphaba dentro de todos nosotros. Hay un poco de Glinda dentro de todos nosotros. Empatizar tan profundamente con estos personajes es la razón por la que la gente ha amado este programa y esta historia durante tanto tiempo"", concluye la guionista.",https://www.bbc.com/mundo/articles/cx2xn21vzmpo
Cómo vieron desde dentro del Despacho Oval el enfrentamiento Zelensky-Trump dos periodistas del Servicio Ucraniano de la BBC,"La jornada comenzó con la misma cordialidad que la Casa Blanca reserva a las visitas de dignatarios extranjeros. El presidente ucraniano, Volodymyr Zelensky, fue recibido por el presidente estadounidense, Donald Trump, en la puerta del Ala Oeste con una guardia de honor, y los líderes se estrecharon las manos cortésmente. Estuvimos en el Despacho Oval como parte del grupo de medios de comunicación ucranianos, presenciando las bien ensayadas formalidades y cerca de media hora de charla cordial. Zelensky entregó a Trump el cinturón del campeón de boxeo ucraniano Oleksandr Usyk. Trump elogió la vestimenta de Zelensky. Hasta aquí, todo diplomacia. Pero minutos después, estalló una situación sin precedentes. El tono cordial se convirtió en acritud y caos. Se levantaron las voces, se pusieron los ojos en blanco, se lanzaron calumnias... y todo ello ante las cámaras de televisión de todo el mundo. El presidente y el vicepresidente estadounidenses reprendieron al líder que les visitaba, acusando a Zelensky de no estar lo suficientemente agradecido por el apoyo de Estados Unidos, que ha sostenido el esfuerzo bélico de Ucrania. Las tensiones estallaron cuando el vicepresidente J.D. Vance dijo a Zelensky que había que poner fin a la guerra mediante la diplomacia. ¿Qué tipo de diplomacia?, replicó Zelensky. Hablando por encima del presidente ucraniano, Vance le dijo al mandatario ucraniano que era una ""falta de respeto"" que acudiera al Despacho Oval a exponer sus argumentos ante los medios estadounidenses y le exigió que agradeciera a Trump su capacidad de liderazgo. Los periodistas presentes en la sala observaron con la boca abierta el extraordinario intercambio que se produjo a continuación. ""Ya has hablado bastante. No vas a ganar esto"", le dijo Trump en un momento dado. ""Tienes que estar agradecido. No tienes las cartas"". ""No estoy jugando a las cartas"", replicó Zelensky. ""Hablo muy en serio, señor presidente. Soy presidente en una guerra"". ""Estás jugando con la Tercera Guerra Mundial"", respondió Trump. ""Y lo que estás haciendo es muy irrespetuoso con el país, este país, que te ha respaldado mucho más de lo que mucha gente dijo que debería haberlo hecho"". Vance replicó: ""¿ Has dicho 'gracias' una vez en toda la reunión? No"". La embajadora de Ucrania en Estados Unidos observaba con la cabeza entre las manos. El ambiente había cambiado por completo, y todo a la vista de los medios. ""Algo impensable"" Nuestros colegas estadounidenses nos comentaron que nunca habían visto nada igual. ""Una escena así era impensable en la Casa Blanca"", me dijo uno de ellos. Cuando los periodistas salieron del Despacho Oval, muchos se quedaron inmóviles en estado de shock. En la sala de prensa de la Casa Blanca, donde poco después se volvió a reproducir el intercambio, el resto de los medios de comunicación que no habían estado en la sala observaban incrédulos. Siguió la confusión. Inmediatamente surgieron dudas sobre si la rueda de prensa prevista seguiría adelante o si se firmaría el tan esperado acuerdo entre Estados Unidos y Ucrania sobre los recursos minerales. Minutos después, Trump escribió en Truth Social que Zelensky podía ""volver cuando esté listo para la paz"". La conferencia de prensa y la ceremonia de firma del acuerdo, previstas en la Sala Este de la Casa Blanca, se cancelaron de manera oficial. Poco después, Zelensky se dirigió a un todoterreno en el que le esperaba su embajadora. Se alejaron mientras el mundo empezaba a digerir un momento extraordinario. A pesar de la rotunda bronca, es posible que tarde o temprano se llegue a un acuerdo sobre los minerales. Pero una cosa es segura: esta visita de Zelensky se recordará por razones totalmente distintas. El mundo vio de primera mano cómo se desarrollan las negociaciones entre Estados Unidos y Ucrania: son difíciles, emocionales y tensas. Quedó claro que se trata de una negociación dura para ambas partes. Desde luego, el regalo del cinturón del boxeador ucraniano Oleksandr Usyk no salvó la situación. Y tras este combate en la Casa Blanca, la verdadera pregunta ahora es qué significa esto para la guerra en Ucrania, y para el propio futuro de Zelensky.",https://www.bbc.com/mundo/articles/cvgp91ev99do
"""Vladimir Putin puede permitirse el lujo de sentarse y ver cómo se desarrollan los acontecimientos""","El drama del viernes en el Despacho Oval provocó una rápida reacción de muchos líderes mundiales. Pero no de Vladimir Putin. De momento, el líder del Kremlin no ha hecho ningún comentario. Pero en realidad no necesita decir nada. El presidente Putin puede permitirse el lujo de sentarse y ver cómo se desarrollan los acontecimientos. Donald Trump calificó que la disputa pública con el presidente Zelensky como ""un gran acontecimiento televisivo"". No cabe duda de que Vladimir Putin habrá disfrutado del ""show"", el dramático espectáculo de Volodymyr Zelensky, líder del país invadido por el presidente Putin, siendo reprendido por el presidente y el vicepresidente de Estados Unidos ante los medios de comunicación de todo el mundo. No obstante, algunos funcionarios rusos sí han comentado lo sucedido en Washington. En una publicación en las redes sociales, el ex presidente Dmitri Medvédev, ahora jefe adjunto del Consejo de Seguridad ruso, escribió que el presidente Zelenski había recibido ""una bofetada en el Despacho Oval"". Pidió a Estados Unidos que pusiera fin a la ayuda militar a Ucrania. Moscú estaría encantado. En Telegram, la portavoz del Ministerio de Asuntos Exteriores, Maria Zakharova, elogió a Trump y a JD Vance por su ""milagrosa contención"" al no haber abofeteado al presidente de Ucrania. Es una señal del aparente nuevo orden mundial en el que, mientras las relaciones entre Estados Unidos y Ucrania corren el riesgo de implosión, ocurre lo contrario con los lazos entre Estados Unidos y Rusia. En las últimas semanas, Trump y Putin han hablado por teléfono y se han comprometido a colaborar estrechamente. Se habla de una posible cumbre en breve, y ya se han iniciado conversaciones a bajo nivel entre Estados Unidos y Rusia para restablecer las relaciones y debatir una posible cooperación económica. El presidente Putin ha presentado como incentivo la promesa de lucrativos proyectos conjuntos con los estadounidenses sobre minerales de tierras raras y producción de aluminio. Las consecuencias de que se rompan las relaciones entre Ucrania y Estados Unidos pueden ser muy graves para Kyiv, pero muy positivas para Moscú. Si se detuviera el flujo de armas estadounidenses a Ucrania, a los ucranianos les resultaría mucho más difícil defenderse de las fuerzas rusas que han invadido su país, aunque Kyiv goce de la solidaridad y el firme apoyo de los líderes europeos. Desde hace algún tiempo, Moscú cree que la guerra en Ucrania se desarrolla a su favor. La pelea a gritos en el Despacho Oval habrá cimentado esa opinión.",https://www.bbc.com/mundo/articles/cqjd49nvz7jo
