title,text,url
Ucrania anuncia un principio de acuerdo para que EE.UU. explote recursos minerales del país tras las amenazas de Trump,"Estados Unidos y Ucrania alcanzaron un acuerdo sobre la cesión de recursos minerales en el país eslavo a cambio de apoyo, informó una fuente de Kyiv a la BBC. El presidente de Estados Unidos, Donald Trump, sugirió este martes que el presidente de Ucrania, Volodymyr Zelensky, viajará el viernes a Washington para firmar el acuerdo. Una fuente del gobierno ucraniano confirmó a la BBC que ambas partes cerraron los términos, mientras agencias de noticias y medios estadounidenses informaron del acuerdo citando a otras fuentes de Kyiv. Aunque la Casa Blanca aún no lo ha confirmado oficialmente, Trump ofreció algunas pistas al responder a periodistas mientras firmaba una nueva tanda de órdenes ejecutivas este martes en el Despacho Oval. En respuesta a una pregunta sobre Zelensky, Trump afirmó: ""he oído que vendrá (a Washington) el viernes"". ""Por supuesto que está bien para mí, si quiere, y a él le gustaría firmarlo conmigo"", apuntó el mandatario estadounidense, en referencia al acuerdo sobre minerales. Preguntado sobre qué obtendrá Ucrania del acuerdo, Trump respondió: ""el derecho a seguir luchando"". De momento ni el gobierno ucraniano ni Zelensky se han pronunciado oficialmente sobre los avances de este martes. La fuente de Kyiv, por su parte, declaró a la BBC: ""lo hemos cerrado con una serie de buenas enmiendas y lo vemos como un resultado positivo"". Qué minerales tiene Ucrania Se estima que alrededor del 5% de las ""materias primas esenciales"" del mundo se encuentran en Ucrania, incluidas: Sin embargo, Rusia se ha apoderado de algunos de los yacimientos minerales. Según Yulia Svyrydenko, ministra de Economía de Ucrania, hoy en día quedan recursos por valor de US$350.000 millones en los territorios ocupados. Lo que se sabe del acuerdo Medios ucranianos también aseguraron que Estados Unidos y Ucrania han ""acordado detalles"" del pacto sobre minerales, cuyo contenido por el momento se desconoce. En su sección de economía, este sitio web conocido como EP especifica que los dos países crearán un ""fondo de inversión para la reconstrucción"", que se calcularía ""según las contribuciones reales de los países al mismo"". El portal agrega que Estados Unidos ""tiene la intención de sellar un compromiso financiero con Ucrania"" que se determinará por separado. Ucrania ha recibido en las últimas semanas una creciente presión del gobierno de Trump para firmar un acuerdo de acceso a sus depósitos minerales. Trump afirmó a principios de este mes que la ayuda militar y económica de Estados Unidos a Ucrania asciende a unos US$500.000 millones y quiere que su país tenga acceso a minerales ucranianos por ese valor. Zelensky cuestionó esa cifra y exigió que cualquier acuerdo incluya garantías de seguridad para su país, en guerra con Rusia desde que este país invadiera su territorio en febrero de 2022. De confirmarse la visita de Zelensky a Washington, llegaría solo una semana después de que el presidente ucraniano y el estadounidense protagonizaran una inusual confrontación dialéctica. Zelensky afirmó que Trump vive en una ""burbuja de desinformación"", a lo que el líder de la Casa Blanca respondió llamándolo ""dictador"" y lanzando acusaciones falsas sobre la supuesta baja popularidad del ucraniano.",https://www.bbc.com/mundo/articles/czx7kpg4666o
La dramática jornada en la ONU en la que EE.UU. votó con Rusia sobre Ucrania y profundizó su distancia con Europa,"Una jornada diplomática dramática en Naciones Unidas puso de manifiesto las crecientes grietas en la alianza transatlántica desde que el presidente Donald Trump regresó al escenario global y cambió radicalmente la política exterior de Estados Unidos. Cuando Rusia invadió Ucrania hace tres años, Europa no tenía un socio más fuerte que Estados Unidos. Pero esta semana, en los pasillos de la Asamblea General y en el Consejo de Seguridad, Estados Unidos trabajó contra sus aliados más cercanos y se puso del lado de Rusia, Bielorrusia y Corea del Norte para aprobar resoluciones sobre el conflicto en Ucrania. El gobierno de Kyiv promovió una resolución simbólica de la Asamblea General en el tercer aniversario de la invasión rusa, que se cumplió el pasado 24 de febrero. Requería que el organismo de 193 miembros reafirmara la integridad territorial de Ucrania y pidiera a Rusia que retirara sus fuerzas de acuerdo con la carta de la ONU. Esa resolución fue aprobada el lunes, pero con menos apoyo que en años anteriores. Muchos miembros se abstuvieron para evitar tensiones con la nueva postura de Estados Unidos. Los diplomáticos de Washington habían instado a otros países a votar en contra de la medida y apoyar en cambio su ""resolución prospectiva"", que constaba de sólo tres breves párrafos en los que adoptó una postura neutral sobre la guerra, evitó culpar a Rusia y pidió un final rápido del conflicto seguido de una paz duradera. Washington no sólo introdujo su medida en la Asamblea General, donde los votos de todos los países tienen el mismo peso, sino también en el Consejo de Seguridad, el órgano más poderoso de la ONU, donde se reúnen las principales potencias. Las resoluciones allí son legalmente vinculantes -aunque a veces difíciles de hacer cumplir- y el poder de veto de Rusia como miembro permanente ha hecho que no se haya podido aprobar en él ninguna iniciativa sobre Ucrania. La medida estadounidense sorprendió a Europa con la guardia baja. Un diplomático europeo le dijo a la BBC que Estados Unidos se comportó como un matón y no tuvo en cuenta su postura sobre la seguridad de su continente. Otro miembro del Consejo de Seguridad, el embajador de Eslovenia, Samuel Zbogar, le dijo a la BBC que Europa está luchando por adaptarse al cambio de 180 grados en la posición de Estados Unidos y a la velocidad a la que se mueve Washington. Apuntó que la Unión Europea necesitará reflexionar un poco en la reunión del consejo del organismo la próxima semana. ""Los líderes tendrán que desarrollar un plan sobre cómo la UE puede participar activamente en la búsqueda de la paz, en lugar de reaccionar a lo que otros están haciendo. Depende de nosotros ahora en Europa dar un paso al frente"", indicó. Hubo muchas reacciones en los pasillos de la sede de la ONU en Nueva York, mientras los líderes europeos trabajaban para digerir la última posición de Estados Unidos. Una votación impensable hace poco La embajadora británica, Barbara Woodward, y el embajador francés, Nicolas De Riviere, intentaron posponer la votación del Consejo de Seguridad, argumentando que sus miembros necesitaban más tiempo para analizar el texto y negociar. Curiosamente, China estaba dispuesta a dar más tiempo para las discusiones, pero Estados Unidos y Rusia, normalmente enfrentados en el consejo, se opusieron. Los miembros europeos del consejo intentaron entonces introducir enmiendas, como habían hecho con éxito anteriormente en la resolución de la Asamblea General, incorporando modificaciones que hicieron que Estados Unidos se abstuviera en su propia resolución. En el Consejo de Seguridad, Estados Unidos amenazó con bloquear las enmiendas propuestas para establecer a Rusia como agresor, reafirmar las fronteras de Ucrania y pedir una paz justa. Sus representantes dijeron que restaban valor a lo que Washington intenta lograr y, en lugar de poner fin al conflicto, buscaban una guerra de términos. Al final, Estados Unidos no tuvo que utilizar su veto porque Rusia votó a favor de bloquear el texto enmendado. La resolución neutral de Estados Unidos finalmente fue aprobada, rompiendo con tres años de parálisis del Consejo de Seguridad sobre Ucrania forzada por el poder de veto de Rusia. Hace apenas unos meses, hubiera parecido impensable que la primera resolución adoptada sobre el conflicto tuviera un lenguaje tan limitado, y que una resolución como esta fuera propuesta por Estados Unidos, tolerada por Rusia y aprobada sin el pleno apoyo de los cinco miembros europeos del Consejo de Seguridad.. Estados Unidos elogió el hecho, la primera acción del consejo para pedir el fin de la guerra. Otros no fueron tan festivos. Richard Gowan, director de Crisis Group, un centro de análisis internacional, dijo que después de tres años de una rivalidad cada vez más profunda entre Rusia y Estados Unidos en la ONU, ver a las dos potencias coordinándose para avergonzar a Europa era bastante sorprendente. Afirmó que, si bien todos esperaban que el presidente Trump fuera disruptor en la ONU, lo ocurrido ha superado la mayoría de las expectativas.",https://www.bbc.com/mundo/articles/cg70z5vpg4jo
El gobierno de Chile declara estado de excepción y toque de queda por el apagón masivo que afecta a gran parte del país,"La Superintendencia de Electricidad y Combustibles de Chile informó este martes que un 80% de los clientes del servicio eléctrico del país se han visto afectados por un apagón masivo. Ante la emergencia, el gobierno chileno convocó al Comité de Gestión del Riesgo de Desastres (Cogrid) para analizar la inédita situación. La ministra del Interior, Carolina Tohá, informó que se decretó estado de excepción por catástrofe y toque de queda desde las 10 de la noche hasta las 6 de la mañana. Esta medida se aplicará desde la región de Arica, en el extremo norte del país, hasta la región de Los Lagos, en la zona sur, por lo que abarca una gran extensión del territorio chileno. Tohá informó que se están haciendo los trabajos para recuperar el servicio eléctrico en el país y que, según sus cálculos, esto debería suceder ""en las próximas horas"". Apuntó que ""no hay ninguna razón para pensar o suponer que detrás de esto hay algún ataque"". ""Se trataría de una falla propia del funcionamiento del sistema"", agregó. Según el Coordinador Eléctrico Nacional, un organismo autónomo que organiza la operación del sistema, las causas del apagón serán investigadas de acuerdo al  protocolo previsto por este tipo de contingencias. La entidad informó haber activado el Plan de Recuperación de Servicio, tras el corte del suministro eléctrico que afectó al país a partir de las 15:16 hora local, desde la región de Arica hasta la de Los Lagos. El apagón, agregó, fue provocado por la desconexión de una parte del sistema de transmisión de electricidad. El corte de luz causó el cierre de comercios, bancos, oficinas y centros comerciales, además de un caos vial debido a la interrupción en el servicio de los semáforos. El Metro en Santiago quedó paralizado, afectando la movilidad de miles de personas en la capital. Los hospitales del país, según informó el Ministerio de Salud, han continuado funcionando con normalidad. En el sector del transporte aéreo, algunas aerolíneas como Latam y Sky informaron a sus pasajeros que algunos de sus vuelos ""podrían verse afectados"" debido a la emergencia.",https://www.bbc.com/mundo/articles/c3vwpddy29zo
Por qué están aumentando los casos de cáncer entre los menores de 50 años,"Cuando Luisa Toscano descubrió que tenía cáncer de mama, se quedó de piedra. ""Fue algo totalmente inesperado"", dice esta brasileña de 38 años, madre de dos hijos. ""Era joven, estaba sana, en forma y no tenía factores de riesgo; se suponía que esto no me iba a pasar a mí. No me lo podía creer. El cáncer parecía tan ajeno a mi realidad"". A Luisa le diagnosticaron cáncer en fase tres en marzo de 2024, lo que significaba que ya estaba avanzado. Se sometió a más de cuatro meses y medio de quimioterapia, seguidos de una intervención quirúrgica para extirparle parte del pecho y radioterapia. Luisa terminó el tratamiento en agosto, pero sigue tomando medicación para evitar que el cáncer reaparezca. ""La quimioterapia fue agresiva, pero mi cuerpo aguantó bien"", recuerda, ""lo que achaco a que soy una persona activa y tengo un cuerpo joven y resistente"". Luego vino la operación. ""Por suerte, no me tuvieron que extirpar todo el pecho. Lo más duro fue perder el pelo. Todo sucedió de forma muy rápida e intensa. Cuando me miraba al espejo, me asustaba, y también afectó a mis hijos"". La historia de Luisa no es un caso aislado, sino que pone de relieve una tendencia mundial: cada vez se diagnostica cáncer a más adultos jóvenes, a menudo sin antecedentes familiares de la enfermedad. El cáncer es más frecuente en las personas mayores debido a factores biológicos, ambientales y de estilo de vida; por ejemplo, el envejecimiento aumenta las divisiones celulares, lo que conduce a la acumulación de mutaciones y a un mayor riesgo de cáncer. Por eso los oncólogos llevan tiempo relacionando los diagnósticos precoces de cáncer en personas jóvenes con factores genéticos hereditarios, como las mutaciones BRCA1 y BRCA2 en el cáncer de mama. Sin embargo, cada vez más pacientes, como Luisa, no muestran signos claros de predisposición genética. Aumento de casos Un nuevo informe de la Sociedad Estadounidense del Cáncer (ACS) señala que las tasas de incidencia de cáncer de mama entre las mujeres blancas menores de 50 años aumentaron un 1,4% anual, frente al 0,7% entre las mayores de 50 años entre 2012 y 2021. Posibles causas Según la Organización Mundial de la Salud, la obesidad está estrechamente relacionada con el aumento del riesgo de cáncer debido a la inflamación y la desregulación hormonal. Sin embargo, estos factores no explican todos los casos. Los científicos están estudiando otros posibles factores. Algunos sostienen que la exposición constante a la luz artificial de aparatos o farolas puede alterar el reloj biológico y aumentar el riesgo de padecer cáncer de mama, colon, ovarios y próstata. Otros estudios han sugerido que el trabajo por turnos, con una exposición prolongada a la luz por la noche, también puede reducir los niveles de melatonina, favoreciendo la aparición del cáncer. En junio de 2023, el cirujano colorrectal Frank Frizelle, de Nueva Zelanda, pidió que se investigara el papel de los microplásticos en el cáncer de intestino, sugiriendo que dañan la capa protectora de la mucosa del colon, de forma similar a ""agujerear un preservativo"". Otros investigadores sostienen que los aditivos de los alimentos ultraprocesados, como emulgentes y colorantes, pueden provocar inflamación intestinal y daños en el ADN. Las alteraciones intestinales están relacionadas no sólo con el cáncer colorrectal, sino también con el de mama y el de sangre, según la Asociación Estadounidense para la Investigación del Cáncer. Según algunos investigadores, el aumento del consumo de antibióticos (un 45% en todo el mundo desde el año 2000), sobre todo entre los niños pequeños, podría ser otro de los factores responsables, ya que altera el microbioma intestinal. Un grupo de científicos italianos sugirió en un informe de 2019 que esto estaba relacionado con el cáncer de pulmón, los linfomas, el cáncer de páncreas, el carcinoma de células renales y el mieloma múltiple. ""El ser humano, en general, en todo el mundo, es cada vez más alto... y existe una fuerte correlación entre la estatura y varios tipos de cáncer, incluido el de colon, por ejemplo"", afirma. Y atribuye el riesgo de cáncer al aumento del número de células, a la exposición a la hormona del crecimiento, que se produce de forma natural, y a una mayor superficie del colon, que aumenta las posibilidades de mutaciones. El doctor Dunlop, uno de los mayores expertos mundiales en genética del cáncer, cree que los cánceres de aparición precoz se deben a múltiples factores convergentes y no a una única causa, pero identificarlos es difícil. ""La mayoría de los factores de riesgo nunca se han analizado en verdaderos ensayos aleatorios de intervención"", señala. También afirma que el cribado del cáncer en poblaciones jóvenes ""no es rentable debido a los bajos riesgos absolutos, a pesar del aumento relativo de casos"". Según el Instituto Nacional del Cáncer (NCI) de EE.UU., el 80% de los casos de cáncer se diagnostican en personas mayores de 55 años. Llamamiento a los médicos Sin embargo, este panorama ha llevado a importantes organizaciones como la Unión Internacional para el Control del Cáncer (UICC) a sensibilizar a los médicos generalistas sobre el cáncer de aparición precoz para que no se pasen por alto los síntomas en pacientes más jóvenes. ""Si una persona mayor de 60 años manifiesta dificultad para defecar, fatiga y distensión abdominal, los médicos se toman en serio estos síntomas y recomiendan un cribado exhaustivo. Sin embargo, en el caso de una persona de 30 años que es activa y no responde al perfil típico del cáncer colorrectal, estos síntomas pueden descartarse como molestias menores"", explica el doctor Alexandre Jácome, director de la Sociedad Brasileña de Oncología Clínica, quien añade que los diagnósticos tardíos ponen en peligro las posibilidades de supervivencia. ""Se trata de personas en la flor de la vida, formando una familia, con todo por delante. Un diagnóstico de cáncer les impacta a ellos y a sus seres queridos"", afirma. Sin embargo, Jácome señala que los pacientes más jóvenes suelen tolerar mejor los tratamientos agresivos cuando se les diagnostica pronto la enfermedad, lo que mejora sus probabilidades de recuperación. Al doctor Dunlop también le preocupan las consecuencias a largo plazo del cáncer precoz. ""Los individuos más jóvenes afectados por estos tipos de cáncer podrían arrastrar este riesgo hasta una edad más avanzada"", advierte. ""¿Insinúa un aumento preocupante en el futuro, o se trata sólo de un grupo de edad concreto expuesto a algo?"". Una experiencia que cambia la vida Después de haber sido tratada de cáncer, Luisa asegura que ""la mayor lección fue aprender a aceptar por igual los días duros y los alegres. Cuando aparecían emociones oscuras, las dejaba fluir. Cuando me sentía fuerte, apreciaba esos momentos, sabiendo que también pasarían"". Su consejo para los demás es: ""Tómatelo día a día. Escucha a tu cuerpo, algunos días lo mejor que puedes hacer es descansar, y no pasa nada. El cáncer conlleva un estigma, una sombra, pero no tiene por qué definirte. Hay vida, crecimiento y sentido incluso en los momentos más duros"".",https://www.bbc.com/mundo/articles/ce30zry24pdo
