title,text,url
El poderoso fondo de inversión de EE.UU. BlackRock acuerda comprar dos puertos en el Canal de Panamá tras la acusación de Trump de influencia china,"Un consorcio de inversores liderado por el gigante BlackRock acordó comprar los puertos de Balboa y Cristóbal en el Canal de Panamá que pertenecen a la firma china CK Hutchison, con sede en Hong Kong. El acuerdo comercial llega semanas después de que el presidente de Estados Unidos, Donald Trump, amenazara al gobierno panameño con recuperar el control del canal que el país centroamericano tiene desde 1999. Los puertos, situados en ambos extremos de la vía fluvial, han estado en el centro de las tensiones políticas entre los gobiernos de Panamá y Estados Unidos, tras las críticas de Trump a la presunta injerencia china en la zona. El mayor fondo de inversión del mundo, BlackRock, su nueva división de infraestructura Global Infrastructure Partners y la firma Terminal Investment, con sede en Ginebra, acordaron además adquirir la participación mayoritaria de CK Hutchison, la cual controla otros 43 puertos en 23 países. CK Hutchison informó que recibiría alrededor de US$19.000 millones gracias al acuerdo comercial. Final de Recomendamos Si se completa, el acuerdo con BlackRock podría contribuir en gran medida a aliviar las preocupaciones sobre la influencia de China sobre el canal, dicen expertos. CK Hutchison informó que la venta es parte de un ""proceso competitivo en el que se recibieron numerosas ofertas y manifestaciones de interés"". ""Me gustaría destacar que la transacción es de naturaleza puramente comercial y no tiene ninguna relación con las noticias políticas recientes sobre los puertos de Panamá"", dijo el codirector gerente de CK Hutchison Frank Sixt. Por qué el Canal de Panamá es una prioridad para Trump El presidente de Estados Unidos ha convertido la recuperación del control estadounidense sobre el Canal de Panamá una de sus prioridades de su política exterior. El mandatario se ha quejado del supuesto control chino del canal y de lo que considera trato injusto a los buques estadounidenses que transitan por la infraestructura. ""Le dimos el canal a Panamá, no a China, y lo vamos a recuperar"", prometió en el discurso inaugural de su presidencia el pasado 20 de enero. Tanto China como Panamá niegan que el gigante asiático controle la vía fluvial. Trump y sus asesores creen en un mundo en que las grandes potencias tengan el control y la influencia dominante en las áreas geográficamente próximas, por lo que el Canal de Panamá, uno de los puntos de tránsito de mercancías más estratégicos del mundo, y muy cercano a Estados Unidos, se ha convertido en una de sus prioridades. Inaugurado en 1914, el Canal fue construido por ingenieros estadounidenses en la ruta que le cedió una Panamá recién independizada de Colombia a la que Washington había apoyado. En 2000, el canal volvió a manos panameñas en virtud del acuerdo firmado en 1978 por el presidente Jimmy Carter para poner fin a la cesión. Trump considera ese un gran error estratégico de Carter. Cuán importantes son los puertos que ha adquirido BlackRock Los puertos de Balboa y Cristóbal son dos de los cinco situados en las áreas adyacentes del canal, por el que se estima que pasa alrededor de un 3% del comercio marítimo mundial. El puerto de Balboa es operado desde 1997 por la empresa Panama Ports Company (PPC), que pertenece desde 2015 a CK Hutchison Holdings, con sede en Hong Kong. Es el segundo puerto con mayor movimiento de contenedores en Panamá, con más de 2,3 millones de Unidades Equivalentes a un Contenedor de 20 pies (TEU, por sus siglas en inglés), la unidad de carga más habitualmente utilizada en el tránsporte marítimo. En la actualidad, Balboa es la terminal de transbordo número uno de América Latina con una capacidad anual potencial de 5 millones de TEU, y colabora con las diferentes líneas navieras para las actividades de embarque, desembarque y trasbordo de mercancías hacia la región, según los datos de Georgia Tech Panama, un centro de investigación logística financiado por el gobierno panameño. Con cinco muelles para barcos portacontenedores, Balboa opera con 25 grúas pórticas. El de Cristóbal es el que tiene menor movimiento de contenedores de los cinco situados en las zonas adyacentes del canal, con 1,38 millones de TEU en 2024. Cuenta con 3 muelles para contenedores y 12 hectáreas dedicadas al manejo y almacenamiento de contenedores respectivamente, y 13 grúas pórticas. Tiene capacidad para manejar 2 millones de TEU al año. Qué es BlackRock BlackRock, la firma que se ha hecho con el control de los dos puertos en el canal, es una compañía de inversiones con sede en Nueva York que maneja más de 7 billones de dólares y un número enorme de clientes y proveedores en todo el mundo. Es una de las empresas de gestión de inversiones más grandes del mundo. Fundada en 1988, ofrece una amplia gama de servicios de inversión, asesoramiento y gestión de riesgos a clientes institucionales y minoristas en todo el mundo. BlackRock ha recibido críticas por mantener su apuesta por las inversiones en los combustibles fósiles pese a los efectos dañinos del cambio climático y distorsionar la competencia por su peso en los mercados financieros. La compañía se ha defendido anunciando cambios en sus políticas. No obstante, tras el triunfo electoral de Donald Trump, anunció su retirada de la Iniciativa de Gerentes para Activos de Cero Emisiones, un grupo de gestores de fondos con el objetivo declarado de reducir las emisiones de gases de efecto invernadero.",https://www.bbc.com/mundo/articles/c93k90wev2eo
Cómo puede afectar a la economía de México que Trump haya impuesto un arancel del 25% a todos sus productos,"Después de muchas amenazas, finalmente llegó el día. Los aranceles generales anunciados por el presidente de Estados Unidos, Donald Trump, del 25% a México y Canadá entraron en vigor este martes. Además, Washington impuso un arancel adicional del 10% sobre las importaciones chinas, lo que se suma a una tasa del 10% que había entrado en vigor el 4 de febrero. Un arancel universal, es decir, a todos los productos de un país, es considerado por los expertos en comercio internacional como una medida muy dura, especialmente cuando está dirigida a sus mayores socios comerciales. Los únicos productos que quedaron sujetos a un arancel reducido del 10% fueron las importaciones energéticas provenientes de Canadá. Final de Recomendamos ""Este arancel permanecerá vigente hasta que las drogas, en particular el fentanilo, y todos los inmigrantes ilegales detengan esta invasión de nuestro país"", informó la Casa Blanca en un comunicado cuando se anunciaron por primera vez en febrero. Sin embargo, tras conversar con los líderes de Canadá y México, y después de que ambos anunciaran medidas de refuerzo de la vigilancia en sus fronteras con Estados Unidos, Trump decidió posponerlos por un mes, plazo que se cumplió este martes. Desde México, la presidenta Claudia Sheinbaum dijo que su país ""tiene que ser respetado"", y aseguró que las ""medidas arancelarias y no arancelarias"" con las que responderá a los gravámenes de EE.UU. serán anunciadas el próximo domingo 9 de marzo. El primer ministro canadiense, Justin Trudeau, reaccionó anunciando la imposición de aranceles del 25%, también a partir de este martes, sobre bienes estadounidenses por valor de US$30.000 millones, los cuales aumentarán hasta alcanzar US$155.000 millones en 21 días. China describió los aranceles estadounidenses como un acto típico de unilateralismo y matonismo, mientras que el Ministerio de Finanzas respondió imponiendo aranceles de entre el 10-15% a los productos alimenticios estadounidenses. ¿Cómo puede afectar a  México? En los días previos al anuncio en febrero, en México había cierto escepticismo sobre la aplicación de un arancel del 25% sobre todos los productos. Parecía más factible que el gobierno de Estados Unidos escogiera algunos productos específicos, en vez de imponer un arancel universal. Pero no fue así. ""Esto va a provocar una recesión en México"", dijo Valeria Moy, directora general del Centro de Investigación en Política Pública, IMCO, en México, en diálogo con BBC Mundo. ""Suena absurdo, suena como una locura"", agregó, refiriéndose a que el mandatario estaría dispuesto a quitar los aranceles solo cuando se resuelvan los problemas de migración y drogas. México, el principal socio comercial de EE.UU., envía más del 80% de sus exportaciones al mercado estadounidense. Es por eso que un 25% de aranceles parece ser un golpe duro para una economía que le vende a su vecino desde autos y semiconductores, hasta petróleo y aguacates. Analistas y empresarios han advertido que un arancel universal no solo afectará las exportaciones, sino también, el crecimiento económico, el empleo, las inversiones, las remesas y el peso mexicano. ¿Cómo funcionan los aranceles? No son otra cosa que un impuesto a los productos importados. Los paga el importador del país que aplica el arancel, en este caso, el importador estadounidense, cuando llega el producto extranjero a la aduana. Como el importador tiene que pagar un precio más alto, habitualmente traspasa una parte de ese costo extra, o todo el costo adicional, a los consumidores estadounidenses. Pero Trump sostiene exactamente lo contrario, cuando argumenta que los aranceles van a ""enriquecer a los estadounidenses"" porque van a generar ingresos adicionales para el gobierno y van a aumentar la capacidad manufacturera del país, creando nuevos empleos y crecimiento económico. La mayor parte de los economistas aseguran que los aranceles afectarán a los países a los que se les impone el gravamen, pero también a EE.UU. ""No solo estás dañando a los consumidores, sino también a los trabajadores y a los productores estadounidenses"", le dijo a BBC Mundo. Los productos más golpeados La manufactura automotriz y la electrónica ocupan los primeros lugares en las exportaciones con mayor valor comercial que hizo México a Estados Unidos en 2023, según cifras de la Secretaría de Economía de México (SE). El monto de esas exportaciones llega a unos US$200.000 millones. Eso es casi la mitad (46%) del valor de todo lo que vendió México a Estados Unidos. Partes de vehículos, autos, camiones, pantallas, equipos médicos, computadores, refrigeradores, y una infinidad de bienes manufacturados que viajan constantemente hacia el país vecino, se verán profundamente afectados. También recibirán un duro golpe el sector energético, el acero y el aluminio, los semiconductores y los productos farmacéuticos, así como las frutas y verduras, los muebles, los productos de la industria panificadora o la cerveza y el tequila. ""Las empresas y los consumidores de las tres economías sufriremos consecuencias de no revertirse esta medida"", le dijo a BBC Mundo Pedro Casas, vicepresidente y director general de la American Chamber of Commerce Mexico, AmCham. Entre ellas, explicó, está el aumento de los costos para los productores y exportadores, la pérdida de empleo, inflación y ""menor poder adquisitivo de nuestras familias"". Un análisis de la consultora internacional Standard and Poor's no ve un panorama muy optimista. La aplicación de aranceles del 25%, ""empujaría a la economía mexicana a una recesión"", señaló en un informe. Un gran desafío para México Los aranceles ponen en juego un sistema de libre comercio de 30 años que ha construido una economía entre los tres países norteamericanos altamente integrada, con autopartes que a veces cruzan las fronteras varias veces antes del ensamblaje final. Si cada producto que forma parte de la manufactura de un bien final es gravado con un arancel cada vez que cruza la aduana, la cadena de suministro se encarece demasiado, poniendo en riesgo el futuro de muchas fábricas a los dos lados de la frontera. Las inversiones estadounidenses en el sector manufacturero mexicano han crecido notablemente desde el primer mandato de Trump, beneficiándose de una mano de obra más barata y del Tratado entre Estados Unidos, México y Canadá, T-MEC, que entró en vigor en julio de 2020 y reemplazó al Tratado de Libre Comercio de América del Norte (Tlcan). Estos aranceles, dicen los expertos, pueden poner en juego la continuidad de ese tratado mientras no se resuelvan las diferencias. El verdadero impacto en las tres economías de América del Norte será más posible de ponderar, en la medida que avance el tiempo. Si los aranceles se imponen durante unas semanas y luego Trump decide suspenderlos, se configura un escenario muy diferente al que se dará si persisten durante un año completo. De todos modos, incluso aunque estuvieran vigentes por unos meses, existen empresas a los dos lados de la frontera que difícilmente podrían resistirlos. Y, por otro lado, la suspensión de inversiones en México por temor a la incertidumbre, también podría dejar una herida bastante dolorosa. El nuevo escenario comercial significa un desafío para el Plan México, presentado por la presidenta Claudia Sheinbaum con la idea de fortalecer la industria nacional y atraer inversiones en el largo plazo.",https://www.bbc.com/mundo/articles/cvgm1kvxgj7o
¿Qué significa para Ucrania que EE.UU. haya suspendido su ayuda militar? (¿y puede Europa suplirla?),"Estados Unidos ha sido el aliado militar y estratégico más relevante para Ucrania desde el inicio de la guerra con Rusia, en 2022. Por eso la decisión del presidente de Estados Unidos, Donald Trump, de suspender toda ayuda al país liderado por Volodymyr Zelensky es un duro golpe no solo para Kyiv, sino también para los países europeos que han instado a la Casa Blanca a hacer su parte para buscar una solución de paz duradera que no implique debilitar aún más la posición de Ucrania. La jugada de Trump se da a solo horas de que el pasado 2 de marzo los países europeos acordaran un plan de 4 puntos para apoyar a Kyiv, incluyendo mayor apoyo militar y económico. Todo luego de que Zelensky y Trump se enfrascaran en una tensa discusión, donde el estadounidense lo acusó de ""jugar con la Tercera Guerra Mundial"" y de no mostrarse lo suficientemente agradecido de la ayuda que Estados Unidos le ha prestado a su país. Este martes, el mandatario ucraniano anunció en un mensaje en X su voluntad de firmar un acuerdo con Estados Unidos sobre explotación de minerales que Trump había pedido para resarcir a EE.UU. por el apoyo militar y económico que ha dado a Kyiv en la guerra con Rusia. Final de Recomendamos Zelensky dijo estar dispuesto a ""sentarse en la mesa de negociaciones lo antes posible para acercar una paz duradera"" con Rusia y reconoció el ""firme liderazgo"" de Trump. Su mensaje parece ser un esfuerzo para reconstruir puentes con Washington para intentar evitar las peores consecuencias de la decisión de Trump de suspender el envío de ayuda a Kyiv. Pero, ¿qué significa para Ucrania la suspensión de este apoyo militar? ¿Podría Europa por sí sola suplir la ayuda que necesita Kyiv? Jonathan Beale, corresponsal de defensa de la BBC, explica que si bien no es la primera vez que Estados Unidos retiene la ayuda militar a Kyiv y que sus efectos pueden tardar en sentirse en el frente de combate, ""el apoyo militar estadounidense sigue siendo vital para Ucrania"". Y no sólo en términos de equipamiento y artillería, sino también en cuestiones estratégicas y de inteligencia, donde Estados Unidos tiene ventajas significativas frente a Europa. Cantidad y calidad Estados Unidos es el país que, de forma individual, más ha gastado en ayuda militar para Ucrania entre 2022 y 2024 , llegando a una inversión de alrededor de US$67 mil millones, según cifras del Kiel Institute for the World Economy, un centro de estudios con sede en Alemania. El resto de los países que han apoyado a los ucranianos durante la guerra, entre todos, sumaron en ese mismo periodo un51% del total de las ayudas recibidas, lo que representa unos US$69 mil millones. Una investigación de BBC Verify, señala que, a grandes rasgos, para mantener el mismo nivel de gasto sin Estados Unidos, todos los demás países que apoyan a Ucrania tendrían que duplicar su apoyo militar. El año pasado, los republicanos en el Congreso bloquearon el mayor paquete de asistencia militar para Ucrania del presidente Joe Biden. En ese momento, Kyiv apenas logró sobrevivir con sus existencias de municiones gracias a la ayuda de Europa. Finalmente, el Congreso aprobó el paquete de ayuda de US$75,4 mil millones, que llegó justo a tiempo, cuando Ucrania estaba luchando por repeler una renovada ofensiva rusa en Járkov. ""Al igual que en 2024, es posible que pasen meses antes de que se sientan los efectos de la interrupción de la ayuda estadounidense, al menos en lo que se refiere a munición y armamento. Los países europeos han aumentado lentamente su producción de proyectiles de artillería. En conjunto, Europa proporciona ahora a Ucrania el 60% de su ayuda, más que Estados Unidos"", apunta Beale. Pese a eso, agrega, la capacidad de Ucrania para proteger a su población y sus ciudades ha dependido en gran medida de los sofisticados sistemas de defensa antiaérea estadounidenses -como las baterías Patriot y NASAMS- desarrollados conjuntamente con Noruega. ""Estados Unidos ha limitado su uso dentro de Rusia, pero siguen siendo vitales para alcanzar objetivos de gran valor dentro de los territorios ocupados"", recalca Beale. Además, destaca que no se trata sólo de calidad, sino también de cantidad. Al ser el ejército más poderoso del mundo, Estados Unidos ha podido enviar cientos de excedentes de Humvees y vehículos blindados, cantidades que los ejércitos europeos más pequeños nunca podrían igualar. Por otro lado, el volumen de artillería que se ha utilizado en este conflicto ha sido enorme. Estados Unidos ha aportado 4,5 millones de proyectiles, mientras que los países de la Unión Europea no alcanzaron el objetivo de entregar 1 millón de proyectiles, aunque se ha comprometido con 2,5 millones para 2025. Vigilancia e inteligencia Lo más preocupante para Ucrania en lo inmediato, según Beale, será la ausencia de apoyo en materia de inteligencia: ""Ningún país puede igualar a Estados Unidos en términos de vigilancia, recopilación de inteligencia y comunicaciones desde el espacio. Y no sólo lo proporcionan las fuerzas armadas estadounidenses, sino también las empresas comerciales"". Una duda que ha surgido en torno a la suspensión de ayuda militar de parte de Estados Unidos, es si este va a impedir que los países europeos envíen sus equipos fabricados en territorio estadounidense a Kyiv. ""Cuando Europa quiso proporcionar aviones F-16 fabricados en EE. UU. a Ucrania, primero tuvo que recibir la aprobación de Washington"", recuerda Beale. ""¿Y qué hay del mantenimiento del equipo suministrado por Washington? EE. UU. también ha estado entrenando a las fuerzas ucranianas y ayudándolas a mantener el equipo suministrado por ellos. Biden levantó las restricciones sobre los contratistas de EE. UU. que trabajaban en Ucrania hacia el final de su mandato. Los aviones F-16, en particular, necesitan ingenieros y repuestos para seguir funcionando"". La decisión de Estados Unidos, se suma a las señales que ha dado el gobierno de Donald Trump respecto de la alianza militar de la OTAN. ""Estoy de acuerdo"", publicó en X el jefe del Departamento de Eficiencia Gubernamental (DOGE), Elon Musk, al compartir  un post que decía ""es hora de dejar la OTAN y la ONU"". Si Estados Unidos avanzara en esa línea, el impacto financiero sería devastador para la alianza.  El aporte de ese país representa un 64% del total del gasto en defensa de la OTAN. De acuerdo con Beale, ""la decisión de Trump de suspender la ayuda puede parecer, para muchos en Ucrania y más allá, una actitud infantil. Pero también hay un claro objetivo político de obligarlos a sentarse a la mesa de negociaciones más pronto. La esperanza entre los aliados europeos es que solo sea una pausa. Sin el apoyo de EE. UU., Ucrania encontrará una lucha aún más dura por su supervivencia"".",https://www.bbc.com/mundo/articles/cg4krkgy07zo
Canadá y China responden con aranceles a las importaciones de EE.UU. en represalia por las medidas de Trump mientras México aplaza su respuesta,"China y Canadá anunciaron nuevos aranceles a las importaciones estadounidenses en represalia a los últimos gravámenes impuestos por el presidente Donald Trump. Por su parte, México esperará hasta el próximo domingo 9 de marzo para anunciar las ""medidas arancelarias y no arancelarias"" con las que responderá a los aranceles de EE.UU., según anunció su presidenta, Claudia Sheinbaum. Los aranceles del 25% sobre los productos de Canadá y México entraron en vigor a primera hora del martes. Trump también confirmó otro arancel del 10% a los productos chinos, sumándose a una tasa adicional del 10% que entró en vigor el 4 de febrero. La respuesta de China llegó de inmediato. Como represalia impondrá aranceles del 10% y el 15% a una serie de importaciones agrícolas estadounidenses, entre otras cosas. Por su parte Canadá dijo que respondería de la misma manera, con aranceles del 25% sobre productos estadounidenses por valor de US$155.000 millones. Final de Recomendamos El primer ministro canadiense, Justin Trudeau, dijo que los aranceles son una ""tontería"". ""Los canadienses somos razonables y educados, pero no nos acobardamos ante una pelea, no cuando esté en juego nuestro país y el bienestar de todos sus habitantes"", dijo Trudeau. ""[EE..UU.] ha elegido sabotear su agenda... Hoy no hay absolutamente ninguna justificación ni necesidad de estos aranceles"". Y añadió: """"Donald, eres un tipo muy inteligente, pero hacer esto es una tontería"". La respuesta mexicana, el domingo La presidenta Claudia Sheinbaum había dicho el lunes que su país ya elaboró ""planes de contingencia"", aunque este martes aseguró que seguirán ""buscando el diálogo"". El comunicado de Washington en el que se anunciaron los aranceles fue calificado por Sheinbaum de ""ofensivo, difamatorio y sin sustento sobre el gobierno de México, que negamos rotundamente y condenamos categóricamente"". Las medidas de respuesta serán anunciadas en asamblea informativa el domingo 9 en el Zócalo, la principal plaza capitalina. ""Hago un llamado al pueblo de México, a todas y a todos, a enfrentar juntos este desafío, a mantenernos con unidad. Reitero, es el tiempo de la defensa de México y su soberanía (...) Orgullosamente, somos un país libre, independiente y soberano"", subrayó Sheinbaum. Más tarde en su rueda de prensa la mandataria mexicana dijo que espera tener una conversación telefónica con Donald Trump el próximo jueves, con lo que se abre la posibilidad de que haya un cambio en la postura del presidente de EE.UU. ""No tenemos exactamente la hora, pero ya les estaremos informando, pues esperemos que sí se dé la llamada, porque el diálogo ayuda, siempre, siempre, siempre, y más el diálogo bilateral de dos presidentes de países vecinos"", agregó Sheinbaum. Pollo, soja, cerdo... Los temores de una guerra comercial en toda regla aumentaron la volatilidad en los mercados de Asia. La entrada en vigor de los aranceles supone la concreción de una amenaza que Trump llevaba tiempo planteando. El presidente estadounidense amenazó con imponer un impuesto a las importaciones a los tres países a principios de este año en respuesta a lo que describe como ""un flujo inaceptable"" de drogas ilegales e inmigrantes indocumentados hacia Estados Unidos. La repuesta de China incluye el inicio de acciones legales contra Washington en la Organización Mundial del Comercio, dejando la puerta abierta a las conversaciones para abordar las preocupaciones de cada uno. Además impondrá aranceles adicionales a algunos productos importados de Estados Unidos, a partir del 10 de marzo, dijo el martes la Comisión de Aranceles Aduaneros de China. Se agregó un arancel adicional del 15% al pollo, trigo, maíz y algodón importados de Estados Unidos. El sorgo, la soja, la carne de cerdo, la carne de res, los productos acuáticos, las frutas, las verduras y los productos lácteos estarán sujetos a un arancel adicional del 10%. Además, China decidió el martes añadir 10 empresas estadounidenses a la lista de entidades no confiables del país y tomar las medidas correspondientes contra ellas. En la lista se incluyen una serie de empresas vinculadas a la defensa y la seguridad, además de inteligencia artificial, aviación, TI y artículos de ""doble uso"" que tienen aplicaciones tanto civiles como militares.",https://www.bbc.com/mundo/articles/cpv4jmrkx28o
